{
  "$schema": "https://mtp.schemas.databiomes.com/v1/model_1_0_0.json",
  "id": "6ba7b810-9dad-11d1-80b4-00c04fd430c8",
  "name": "cat-v2",
  "description": "This Cat is even fluffier than previous one.",
  "created_time": "1995-08-03T12:00:00Z",
  "files": [
    {
      "path": "weights.bin",
      "checksum": "sha256:a1b2c3d4e5f6g7h8i9j0k1l2m3n4o5p6q7r8s9t0u1v2w3x4y5z6a7b8c9d0e1f2"
    },
    {
      "path": "tokenizer.bin",
      "checksum": "sha256:f2e1d0c9b8a7z6y5x4w3v2u1t0s9r8q7p6o5n4m3l2k1j0i9h8g7f6e5d4c3b2a1"
    }
  ],
  "training": {
    "reference": "blm-42"
  },
  "labels": {
    "type": "cat",
    "color": "black"
  }
}
